{
  "recording_mbid": "1b042317-065c-41e5-a6bf-b9567b0aafb9",
  "schema_version": 1,
  "sources": [
    {
      "candidate_id": "HfAtQ8jLRM4",
      "candidate_url": "https://www.youtube.com/watch?v=HfAtQ8jLRM4",
      "confidence": 1.0,
      "duration_delta_ms": 0,
      "duration_ms": 294840,
      "last_verified_at": "2026-03-25T18:46:01+00:00",
      "retreivr_version": "backfill",
      "source": "youtube",
      "verified_by": "retreivr_backfill",
      "video_id": "HfAtQ8jLRM4"
    }
  ],
  "updated_at": "2026-03-25T21:16:33+00:00"
}
