{
  "recording_mbid": "5091ebf5-8b77-4e27-a204-6147191129b1",
  "schema_version": 1,
  "sources": [
    {
      "candidate_id": "diXEoV7kiSM",
      "candidate_url": "https://www.youtube.com/watch?v=diXEoV7kiSM",
      "confidence": 1.0,
      "duration_delta_ms": 0,
      "duration_ms": 316896,
      "last_verified_at": "2026-03-25T18:38:25+00:00",
      "retreivr_version": "backfill",
      "source": "youtube",
      "verified_by": "retreivr_backfill",
      "video_id": "diXEoV7kiSM"
    }
  ],
  "updated_at": "2026-03-25T20:22:38+00:00"
}
