{
  "recording_mbid": "93b8be83-29aa-4be7-b050-7f1ebdcdf9d5",
  "schema_version": 1,
  "sources": [
    {
      "candidate_id": "CPcfYNN9JUI",
      "candidate_url": "https://www.youtube.com/watch?v=CPcfYNN9JUI",
      "confidence": 1.0,
      "duration_delta_ms": 0,
      "duration_ms": 211200,
      "last_verified_at": "2026-03-26T14:46:48+00:00",
      "retreivr_version": "backfill",
      "source": "youtube",
      "verified_by": "retreivr_backfill",
      "video_id": "CPcfYNN9JUI"
    }
  ],
  "updated_at": "2026-03-26T20:59:02+00:00"
}
