{
  "recording_mbid": "47c313ca-85c7-4e2f-b6da-d64f1010f917",
  "schema_version": 1,
  "sources": [
    {
      "candidate_id": "QJTuCCygjOo",
      "candidate_url": "https://www.youtube.com/watch?v=QJTuCCygjOo",
      "confidence": 1.0,
      "duration_delta_ms": 0,
      "duration_ms": 247032,
      "last_verified_at": "2026-03-25T18:43:25+00:00",
      "retreivr_version": "backfill",
      "source": "youtube",
      "verified_by": "retreivr_backfill",
      "video_id": "QJTuCCygjOo"
    }
  ],
  "updated_at": "2026-03-25T21:21:47+00:00"
}
