{
  "recording_mbid": "de7bca2f-2c60-4211-9de7-a6b7ddaae2d8",
  "schema_version": 1,
  "sources": [
    {
      "candidate_id": "jNvIG78waL8",
      "candidate_url": "https://www.youtube.com/watch?v=jNvIG78waL8",
      "confidence": 1.0,
      "duration_delta_ms": 0,
      "duration_ms": 277152,
      "last_verified_at": "2026-03-26T14:47:35+00:00",
      "retreivr_version": "backfill",
      "source": "youtube",
      "verified_by": "retreivr_backfill",
      "video_id": "jNvIG78waL8"
    }
  ],
  "updated_at": "2026-03-26T21:06:20+00:00"
}
