{
  "recording_mbid": "5a48cf8c-87cd-422d-a663-6747ade1aef1",
  "schema_version": 1,
  "sources": [
    {
      "candidate_id": "x3um5ELjkcE",
      "candidate_url": "https://www.youtube.com/watch?v=x3um5ELjkcE",
      "confidence": 1.0,
      "duration_delta_ms": 0,
      "duration_ms": 198936,
      "last_verified_at": "2026-03-25T18:38:50+00:00",
      "retreivr_version": "backfill",
      "source": "youtube",
      "verified_by": "retreivr_backfill",
      "video_id": "x3um5ELjkcE"
    }
  ],
  "updated_at": "2026-03-26T03:17:18+00:00"
}
