{
  "recording_mbid": "877a76ff-3cf5-4788-aefa-be7a914615f3",
  "schema_version": 1,
  "sources": [
    {
      "candidate_id": "hIiakqYOg5o",
      "candidate_url": "https://www.youtube.com/watch?v=hIiakqYOg5o",
      "confidence": 1.0,
      "duration_delta_ms": 0,
      "duration_ms": 228816,
      "last_verified_at": "2026-03-25T18:39:49+00:00",
      "retreivr_version": "backfill",
      "source": "youtube",
      "verified_by": "retreivr_backfill",
      "video_id": "hIiakqYOg5o"
    }
  ],
  "updated_at": "2026-03-25T21:21:48+00:00"
}
