{
  "recording_mbid": "9dea8cd3-fb8f-43c8-bffb-7d03b3b36af7",
  "schema_version": 1,
  "sources": [
    {
      "candidate_id": "Fw1g_xDCf1A",
      "candidate_url": "https://www.youtube.com/watch?v=Fw1g_xDCf1A",
      "confidence": 1.0,
      "duration_delta_ms": 0,
      "duration_ms": 224952,
      "last_verified_at": "2026-03-26T14:44:10+00:00",
      "retreivr_version": "backfill",
      "source": "youtube",
      "verified_by": "retreivr_backfill",
      "video_id": "Fw1g_xDCf1A"
    }
  ],
  "updated_at": "2026-03-26T20:58:51+00:00"
}
